unitid,institution name,A,A2,unitid,institution name,B,Random,unitid,institution name,C,unitid,institution name,D
218238,Limestone University,1943,1943,218238,Limestone University,2661,0.76024288,188438,SUNY Adirondack,2994,188438,SUNY Adirondack,3892
156286,Bellarmine University,3293,3293,156286,Bellarmine University,3757,0.077500214,189547,SUNY Broome Community College,5386,189547,SUNY Broome Community College,5624
170967,Rochester University,1231,1231,170967,Rochester University,1168,0.188581407,189839,Cayuga County Community College,2906,189839,Cayuga County Community College,3784
239460,Northcentral Technical College,5939,5939,239460,Northcentral Technical College,5167,0.128201131,190053,Clinton Community College,1060,190053,Clinton Community College,1547
140234,LaGrange College,854,854,140234,LaGrange College,1049,0.039795621,190169,Columbia-Greene Community College,1445,190169,Columbia-Greene Community College,1620
148496,Dominican University,3189,3189,148496,Dominican University,3127,0.301024342,190442,SUNY Corning Community College,4063,190442,SUNY Corning Community College,3834
204468,Notre Dame College,1585,1585,204468,Notre Dame College,1901,0.284097087,190840,Dutchess Community College,8034,190840,Dutchess Community College,9061
102234,Spring Hill College,1191,1191,102234,Spring Hill College,1485,0.294616933,191083,Erie Community College,8364,191083,Erie Community College,11135
164924,Boston College,14934,14934,164924,Boston College,14628,0.844861697,191126,Fashion Institute of Technology,8191,191126,Fashion Institute of Technology,8846
217493,Rhode Island School of Design,2227,2227,217493,Rhode Island School of Design,2440,0.044782818,191199,Finger Lakes Community College,5640,191199,Finger Lakes Community College,6356
110495,California State University-Stanislaus,11163,11163,110495,California State University-Stanislaus,10327,0.501162574,191302,Fulton-Montgomery Community College,1946,191302,Fulton-Montgomery Community College,2403
107983,Southern Arkansas University Main Campus,4432,4432,107983,Southern Arkansas University Main Campus,4643,0.366283966,191339,Genesee Community College,4735,191339,Genesee Community College,5906
170806,Madonna University,2792,2792,170806,Madonna University,3086,0.327471787,191612,Herkimer County Community College,2224,191612,Herkimer County Community College,2632
133881,Florida Institute of Technology,6775,6775,133881,Florida Institute of Technology,6379,0.863356256,191719,Hudson Valley Community College,8933,191719,Hudson Valley Community College,11020
126289,Arapahoe Community College,12001,12001,126289,Arapahoe Community College,12421,0.579025577,191986,Jamestown Community College,3430,191986,Jamestown Community College,4463
200332,North Dakota State University-Main Campus,12846,12846,200332,North Dakota State University-Main Campus,14358,0.200809388,192022,Jefferson Community College,2658,192022,Jefferson Community College,3460
209612,Pacific University,3808,3808,209612,Pacific University,3893,0.759904849,193283,Mohawk Valley Community College,5704,193283,Mohawk Valley Community College,6506
229018,The University of Texas Permian Basin,5530,5530,229018,The University of Texas Permian Basin,7022,0.371178276,193326,Monroe Community College,10161,193326,Monroe Community College,12907
130624,United States Coast Guard Academy,1056,1056,130624,United States Coast Guard Academy,1044,0.276784208,193478,Nassau Community College,13864,193478,Nassau Community College,19059
236230,Pacific Lutheran University,2907,2907,236230,Pacific Lutheran University,3122,0.344327694,193946,Niagara County Community College,4389,193946,Niagara County Community College,5439
138354,The University of West Florida,13061,13061,138354,The University of West Florida,13040,0.725820058,194028,North Country Community College,1602,194028,North Country Community College,2006
233921,Virginia Polytechnic Institute and State University,37024,37024,233921,Virginia Polytechnic Institute and State University,34440,0.017147192,194222,Onondaga Community College,8545,194222,Onondaga Community College,10659
228608,Temple College,4940,4940,228608,Temple College,4999,0.532326713,194240,Orange County Community College,5862,194240,Orange County Community College,6601
206437,Walsh University,2651,2651,206437,Walsh University,2759,0.050311933,195058,Rockland Community College,5735,195058,Rockland Community College,6950
190585,CUNY Hostos Community College,6136,6136,190585,CUNY Hostos Community College,7211,0.224440449,195322,Schenectady County Community College,4015,195322,Schenectady County Community College,6588
183239,Saint Anselm College,2019,2019,183239,Saint Anselm College,1964,0.887293624,195988,Sullivan County Community College,1701,195988,Sullivan County Community College,1565
209542,Oregon State University,32312,32312,209542,Oregon State University,30896,0.131314665,196006,SUNY College of Technology at Alfred,3667,196006,SUNY College of Technology at Alfred,3686
188058,Northern New Mexico College,1234,1234,188058,Northern New Mexico College,948,0.972771451,196015,SUNY College of Technology at Canton,3135,196015,SUNY College of Technology at Canton,3180
150136,Ball State University,21597,21597,150136,Ball State University,22513,0.110302262,196024,SUNY College of Technology at Delhi,3077,196024,SUNY College of Technology at Delhi,3511
224527,East Texas Baptist University,1714,1714,224527,East Texas Baptist University,1533,0.860880581,196033,SUNY College of Agriculture and Technology at Cobleskill,2079,196033,SUNY College of Agriculture and Technology at Cobleskill,2291
234085,Virginia Military Institute,1698,1698,234085,Virginia Military Institute,1722,0.68958555,196042,Farmingdale State College,10018,196042,Farmingdale State College,9574
141574,University of Hawaii at Manoa,18025,18025,141574,University of Hawaii at Manoa,17612,0.487947981,196051,SUNY Morrisville,2486,196051,SUNY Morrisville,3063
141990,Windward Community College,2299,2299,141990,Windward Community College,2511,0.594124006,196060,SUNY at Albany,17688,196060,SUNY at Albany,17743
100812,Athens State University,2867,2867,100812,Athens State University,3114,0.607100176,196079,Binghamton University,18148,196079,Binghamton University,17351
193292,Molloy College,5115,5115,193292,Molloy College,4980,0.843582602,196088,University at Buffalo,32347,196088,University at Buffalo,30648
139719,Fort Valley State University,3079,3079,139719,Fort Valley State University,2752,0.434897011,196097,Stony Brook University,26782,196097,Stony Brook University,25989
206695,Youngstown State University,11835,11835,206695,Youngstown State University,12521,0.932145022,196103,SUNY College of Environmental Science and Forestry,2127,196103,SUNY College of Environmental Science and Forestry,2213
177986,Logan University,1806,1806,177986,Logan University,1371,0.695413251,196112,SUNY Polytechnic Institute,3044,196112,SUNY Polytechnic Institute,2912
198321,Cleveland Community College,2269,2269,198321,Cleveland Community College,2700,0.66910772,196121,SUNY Brockport,7592,196121,SUNY Brockport,8313
139621,East Georgia State College,2415,2415,139621,East Georgia State College,3003,0.203079579,196130,SUNY Buffalo State,8339,196130,SUNY Buffalo State,9516
199485,Rockingham Community College,1922,1922,199485,Rockingham Community College,1931,0.79472467,196149,SUNY Cortland,6832,196149,SUNY Cortland,6913
212009,Dickinson College,1932,1932,212009,Dickinson College,2382,0.683944302,196158,SUNY at Fredonia,4055,196158,SUNY at Fredonia,4630
216010,Shippensburg University of Pennsylvania,6130,6130,216010,Shippensburg University of Pennsylvania,6570,0.147345876,196167,SUNY College at Geneseo,4911,196167,SUNY College at Geneseo,5652
240657,Northwest College,1438,1438,240657,Northwest College,1654,0.308919561,196176,State University of New York at New Paltz,7489,196176,State University of New York at New Paltz,7565
205443,Shawnee State University,3485,3485,205443,Shawnee State University,3582,0.981054884,196185,SUNY Oneonta,6718,196185,SUNY Oneonta,6358
198598,Greensboro College,944,944,198598,Greensboro College,1001,0.304595812,196194,SUNY College at Oswego,7636,196194,SUNY College at Oswego,8026
122409,San Diego State University,36334,36334,122409,San Diego State University,35135,0.309229474,196200,SUNY College at Potsdam,3084,196200,SUNY College at Potsdam,3587
199333,Pitt Community College,7688,7688,199333,Pitt Community College,8256,0.182569729,196219,SUNY at Purchase College,3685,196219,SUNY at Purchase College,4167
150677,Grace College and Theological Seminary,1901,1901,150677,Grace College and Theological Seminary,2156,0.901243018,196228,SUNY College of Optometry,402,196228,SUNY College of Optometry,413
211431,Carlow University,1976,1976,211431,Carlow University,2140,0.067317167,196237,SUNY College at Old Westbury,5007,196237,SUNY College at Old Westbury,4910
199111,University of North Carolina at Asheville,3363,3363,199111,University of North Carolina at Asheville,3852,0.045983363,196246,SUNY College at Plattsburgh,5109,196246,SUNY College at Plattsburgh,5719
139700,Georgia Highlands College,5680,5680,139700,Georgia Highlands College,6013,0.326376451,196255,SUNY Downstate Health Sciences University,2118,196255,SUNY Downstate Health Sciences University,1792
198251,Central Carolina Community College,5154,5154,198251,Central Carolina Community College,5187,0.462825745,196264,SUNY Empire State College,10724,196264,SUNY Empire State College,10977
122612,University of San Francisco,10068,10068,122612,University of San Francisco,11063,0.550560993,196291,SUNY Maritime College,1671,196291,SUNY Maritime College,1794
213400,Lancaster Bible College,2038,2038,213400,Lancaster Bible College,2064,0.327898523,196307,Upstate Medical University,1528,196307,Upstate Medical University,1484
198118,Caldwell Community College and Technical Institute,3845,3845,198118,Caldwell Community College and Technical Institute,3495,0.297386054,196565,Tompkins Cortland Community College,4764,196565,Tompkins Cortland Community College,2632
155317,University of Kansas,26744,26744,155317,University of Kansas,27625,0.1608097,196699,Ulster County Community College,3089,196699,Ulster County Community College,3560
153977,Mercy College of Health Sciences,869,869,153977,Mercy College of Health Sciences,758,0.12372554,197294,SUNY Westchester Community College,10072,197294,SUNY Westchester Community College,12571
130697,Wesleyan University,3053,3053,130697,Wesleyan University,3213,0.894679224,366395,Suffolk County Community College,22570,366395,Suffolk County Community College,26756
